riskid,riskselect,risktype,riskclassification,riskprobability,riskimpact,riskscore,risktimeline,risktrigger,riskresponse,riskowner,riskdescription,riskcontingency
1,Y,Strategic,Stakeholders,1-High,1-High,3-Lowest,1-Plan,engagement,Accept,Sponsor,"Executives fail to support project. The project team may lack the authority to achieve project objectives. In such cases, executive management support is fundamental to project success. When this does not materialize the project fails.",
2,Y,Project,Stakeholders,3-Low,3-Low,1-Highest,2-Design,engagement,Mitigate,Sponsor,Executives become disengaged with project. Executive management disregards project communications and meetings.,
3,Y,Operations,Stakeholders,3-Low,1-High,1-Highest,3-Build,sentiment,Transfer,Sponsor,Conflict between executive stakeholders disrupts project.  Members of executive management are combative to the project or there is a disagreement over project issues at the executive level.,
4,Y,Business,Stakeholders,1-High,3-Low,1-Highest,5-Accept,retention,Avoid,Sponsor,"Executive turnover disrupts project.  A key executive leaves the company, the resulting disruption becomes a project issue.",
5,Y,Environmental,Scope,2-Moderate,2-Moderate,2-Moderate,2-Design,scopechange,Avoid,ProjectManager,Scope is ill defined.  The general risk of an error or omission in scope definition.,
6,Y,Project,Scope,1-High,2-Moderate,2-Moderate,2-Design,scopechange,Avoid,ProductOwner,Scope creep inflates scope.  Uncontrolled changes and continuous growth of scope.,
7,Y,Project,Scope,3-Low,3-Low,1-Highest,2-Design,cpi,Avoid,ProductOwner,Gold plating inflates scope.  The project team add their own product features that are not in requirements or change requests.,
8,Y,Project,Scope,1-High,2-Moderate,2-Moderate,2-Design,cpi,Avoid,AgileTeam,Estimates are inaccurate.  Inaccurate estimates is a common project risk.,
9,Y,Project,Scope,1-High,2-Moderate,2-Moderate,2-Design,cpi,Avoid,AgileTeam,Dependencies are inaccurate. Dependencies dramatically impact the project schedule and costs.,
11,Y,Project,Cost,2-Moderate,1-High,2-Moderate,2-Design,earnedvalue,Mitigate,ProjectManager,Cost forecasts are inaccurate. Inaccurate cost estimates and forecasts.,
10,Y,Project,Scope,1-High,3-Low,1-Highest,2-Design,scopechange,Avoid,AgileTeam,Activities are missing from scope. Required activities are missing from scope definition.,
12,Y,Market,Cost,2-Moderate,1-High,2-Moderate,2-Design,external,Accept,Sponsor,Exchange rate variability. When costs are incurred in foreign currencies exchange rates can have a dramatic impact.,
13,Y,Project,Change,2-Moderate,1-High,2-Moderate,2-Design,scopechange,Avoid,ProductOwner,Change management overload. A large number of change requests dramatically raises the complexity of the project and distracts key resources.,
14,Y,Project,Change,2-Moderate,1-High,2-Moderate,2-Design,sentiment,Avoid,ProductOwner,Stakeholder conflict over proposed changes. Change requests may be the source of stakeholder conflict.,
15,Y,Project,Change,2-Moderate,1-High,2-Moderate,3-Build,sentiment,Avoid,Sponsor,Perceptions that a project failed because of changes.  Large numbers of high priority change requests may lead to the perception that the project has failed. When the schedule and budget are continually extended — stakeholders may feel the project missed its original targets.,
16,Y,Project,Change,2-Moderate,1-High,2-Moderate,2-Design,earnedvalue,Avoid,ProjectManager,Lack of a change management system. Failure to record and communicate changes are a risk.,
17,Y,Project,Change,2-Moderate,1-High,2-Moderate,2-Design,engagement,Avoid,ProjectManager,"Lack of a change management process. Change management at the organizational or departmental level is critical to project success. Otherwise, the project will have limited visibility into changes that impact the project.",Establish a change control process early in the project.
18,Y,Project,Change,2-Moderate,1-High,2-Moderate,1-Plan,engagement,Avoid,ProjectManager,Lack of a change control board. A change control board is essential to managing change for large projects.,Establish a change control process early in the project.
19,Y,Project,Change,2-Moderate,1-High,2-Moderate,1-Plan,engagement,Avoid,ProjectManager,Inaccurate change priorities.  When non-essential changes are prioritized impacting critical schedules.,Establish a change control process early in the project.
20,Y,Project,Change,2-Moderate,1-High,2-Moderate,1-Plan,inspectionfailure,Avoid,AgileTeam,Low quality of change requests.  Change requests that are low quality (e.g. ambiguous).,TDD Quality Assurance (inspection) of requirements and acceptance criteria in user stories .
21,Y,Project,Change,1-High,1-High,3-Lowest,5-Accept,sentiment,Avoid,ProductOwner,Change request conflicts with requirements.  Change requests that make no sense in the context of the requirements.,
22,Y,Project,Stakeholders,2-Moderate,1-High,2-Moderate,1-Plan,engagement,Avoid,Sponsor,Stakeholders become disengaged. When stakeholders ignore project communications.,"Determine stakeholder influence and interest early in project, and monitor engagement and sentiment throughout"
23,Y,Project,Stakeholders,2-Moderate,3-Low,2-Moderate,5-Accept,sentiment,Avoid,Sponsor,"Stakeholders have inaccurate expectations. Stakeholders develop inaccurate expectations (believe that the project will achieve something not in the requirements, plan, etc).",Determine stakeholder influence and interest early in project
24,Y,Project,Stakeholders,2-Moderate,2-Moderate,2-Moderate,2-Design,retention,Accept,Sponsor,Stakeholder turnover. Stakeholder turnover can lead to project disruptions.,Communicate plan to the new stakeholders.  Stakeholder chagnes are processed in project change process
25,Y,Project,Stakeholders,2-Moderate,1-High,2-Moderate,1-Plan,sentiment,Avoid,Sponsor,Stakeholders fail to support project.  When stakeholders have a negative attitude towards the project and wish to see it fail.,Determine stakeholder influence and interest early in project
26,Y,Project,Stakeholders,2-Moderate,1-High,2-Moderate,5-Accept,sentiment,Avoid,Sponsor,Stakeholder conflict.  Disagreement between stakeholders over project issues.,Determine stakeholder influence and interest early in project
27,Y,Project,Stakeholders,2-Moderate,1-High,2-Moderate,5-Accept,earnedvalue,Avoid,ProductOwner,"Process inputs are low quality. Inputs from stakeholders that are low quality (e.g. business case, requirements, change requests).",Determine stakeholder influence and interest early in project
28,Y,Project,Communication,2-Moderate,2-Moderate,2-Moderate,5-Accept,inspectionfailure,Avoid,AgileTeam,"Project team misunderstand requirements.  When requirements are misinterpreted by the project team a gap develops between expectations, requirements and work packages.",TDD Quality Assurance (inspection) of requirements and acceptance criteria in user stories .
29,Y,Project,Communication,2-Moderate,1-High,2-Moderate,1-Plan,inspectionfailure,Avoid,ProjectManager,Communication overhead.  When key project resources spend a high percentage of their time engaging stakeholders on project issues and change requests their work may fall behind.,TDD Quality Assurance (inspection) of requirements and acceptance criteria in user stories .
30,Y,Project,Communication,2-Moderate,1-High,2-Moderate,5-Accept,engagement,Avoid,ProjectManager,Under communication. Communication is a challenge thats not to be underestimated. You may need to communicate the same idea many times in different ways before people remember it.,Update or improve the Communication Plan.  Determine stakeholder influence and interest early in project
31,Y,Project,Communication,2-Moderate,1-High,2-Moderate,5-Accept,engagement,Avoid,ProductOwner,Users have inaccurate expectations.  The risk that users believe the project is building an apple when you are really building an orange (i.e. users do not understand the product thats coming their way).,Update or improve the Communication Plan.  Determine stakeholder influence and interest early in project
32,Y,Project,Communication,2-Moderate,1-High,2-Moderate,1-Plan,engagement,Avoid,ProjectManager,"Impacted individuals are not kept informed. A stakeholder is missing in your communication plan. 9one who is not informed but is impacted has an excellent reason to throw up project roadblocks. For example, if you build a system but fail to consult the operations group that will be responsible for support.",Update or improve the Communication Plan
33,Y,Project,Team,2-Moderate,1-High,2-Moderate,2-Design,retention,Avoid,ProjectManager,Resource shortfalls. Inability to secure sufficient resources for the project.,"Review resource plan and budget for resources, extend your search globally "
33,Y,Project,Team,2-Moderate,1-High,2-Moderate,3-Build,retention,Avoid,ProjectManager,Resource shortfalls. Inability to secure sufficient resources for the project.,"Review resource plan and budget for resources, extend your search globally "
34,Y,Project,Team,2-Moderate,1-High,2-Moderate,5-Accept,cpi,Avoid,ProjectManager,Learning curves lead to delays and cost overrun.  When your project team need to acquire new skills for the project theres a risk that productivity will be low.,"Review resource plan and budget for resources, extend your search globally with skilled resources"
35,Y,Project,Team,1-High,2-Moderate,2-Moderate,1-Plan,engagement,Avoid,ProjectManager,Training is not available.  Quality training for certain skills can be difficult to secure.,"Review resource plan and budget for resources, extend your search globally with skilled resources for training. "
36,Y,Project,Team,2-Moderate,1-High,2-Moderate,1-Plan,engagement,Avoid,ProjectManager,Training is inadequate.  Training is often a poor substitute for professional experience. Projects should not assume that resources will be fully productive in a new skill.,"Review resource plan and budget for resources, extend your search globally with skilled resources for training. "
37,Y,Project,Team,2-Moderate,1-High,2-Moderate,5-Accept,spi,Avoid,ProjectManager,Resources are inexperienced.  Resources who are just out of school or who are new to your industry or profession tend to make more mistakes and be less productive.,"Review resource plan and budget for resources, extend your search globally with skilled resources for training. "
38,Y,Project,Team,2-Moderate,1-High,2-Moderate,5-Accept,spi,Mitigate,ProjectManager,Resource performance issues. Resources who perform below expectations.,Review resource plan.  Coaching or replace resources.
39,Y,Project,Team,2-Moderate,1-High,2-Moderate,5-Accept,sentiment,Mitigate,ProjectManager,Team members with negative attitudes towards the project.  Resources who are negative towards the project may actively or passively sabotage project efforts.,Review resource plan.  Coaching or replace resources.
40,Y,Project,Team,2-Moderate,1-High,2-Moderate,1-Plan,retention,Mitigate,ProjectManager,Resource turnover.  Resource turnover leads to delays and cost overrun.,Resource planning.   Plan for changes in key resources at start of project.  Ensure onboarding activites and documentation is up to date to ensure efficient transition. 
41,Y,Project,Team,2-Moderate,1-High,2-Moderate,5-Accept,sentiment,Mitigate,ProjectManager,Low team motivation.  Your team lacks motivation. This is a particularly common risk for long running projects.,Review resource plan.  Coaching or replace resources.
42,Y,Project,Team,2-Moderate,2-Moderate,2-Moderate,5-Accept,engagement,Mitigate,ProjectManager,Lack of commitment from functional managers.  In a matrix organization your team may report to functional managers. These functional managers are important stakeholders whose support is critical.,Update or improve the Communication Plan.  Determine functional manager influence and interest early in project
43,Y,Project,Technology,2-Moderate,2-Moderate,2-Moderate,5-Accept,spi,Avoid,AgileTeam,Architecture fails to pass governance processes.  Plan for any architectural or technology governance processes that the project may need to pass.,
44,Y,Project,Technology,1-High,3-Low,1-Highest,3-Build,spi,Accept,AgileTeam,Architecture lacks flexibility. The architecture is incapable of supporting change requests and needs to be reworked.,Rework Architecture.  Increase expert inspections and architecture reviews.
45,Y,Project,Technology,1-High,3-Low,1-Highest,5-Accept,spi,Accept,AgileTeam,Architecture is not fit for purpose.  The architecture is low quality.,Rework Architecture.  Increase expert inspections and architecture reviews.
46,Y,Project,Technology,2-Moderate,1-High,2-Moderate,5-Accept,cpi,Avoid,ProjectManager,"Architecture is infeasible.  The architecture is impossible to implement, excessively costly or does not support the requirements.",Quality Assurance Planning.  Increase expert inspections and four eyes
47,Y,Project,Requirements,2-Moderate,1-High,2-Moderate,2-Design,inspectionfailure,Avoid,AgileTeam,"Design is infeasible.  The design is not possible, is excessively costly or does not support the requirements.","Quality Assurance Planning.  TDD Test driven development, increase inspections"
48,Y,Project,Requirements,2-Moderate,1-High,2-Moderate,2-Design,inspectionfailure,Avoid,AgileTeam,Design lacks flexibility.  A poor design makes change requests difficult and costly.,"Quality Assurance Planning.  TDD Test driven development, increase inspections"
49,Y,Project,Requirements,2-Moderate,1-High,2-Moderate,1-Plan,inspectionfailure,Avoid,AgileTeam,Design is not fit for purpose. The design is low quality.,"Quality Assurance Planning.  TDD Test driven development, increase inspections"
50,Y,Project,Requirements,2-Moderate,1-High,2-Moderate,2-Design,inspectionfailure,Avoid,AgileTeam,Design fails peer review.  It is a good idea to have peers or architectural experts review your designs.,"Quality Assurance Planning.  TDD Test driven development, increase inspections"
51,Y,Project,Technology,2-Moderate,1-High,2-Moderate,5-Accept,inspectionfailure,Avoid,AgileTeam,Technology components are not fit for purpose. Technology components are low quality.,"Quality Assurance Planning.  TDD Test driven development, increase inspections"
52,Y,Operations,Technology,2-Moderate,1-High,2-Moderate,5-Accept,inspectionfailure,Avoid,AgileTeam,Technology components are not scalable.  Components that cannot be scaled to meet performance demands.,Quality Assurance Planning.  Performance planning and testing
53,Y,Project,Technology,1-High,3-Low,1-Highest,5-Accept,spi,Accept,AgileTeam,Technology components are not interoperable.  Components that lack standard interfaces.,
54,Y,Project,Technology,2-Moderate,1-High,2-Moderate,1-Plan,inspectionfailure,Accept,AgileTeam,Technology components are not compliant with standards and best practices.  Non-standard components that violate best practices.,
55,Y,Operations,Technology,2-Moderate,2-Moderate,2-Moderate,1-Plan,external,Mitigate,AgileTeam,Technology components have security vulnerabilities. Security vulnerabilities are key technology risks.,Quality Assurance Planning.  Automated scanning and inspection
56,Y,Project,Technology,1-High,1-High,3-Lowest,5-Accept,cpi,Avoid,AgileTeam,Technology components are over-engineered.  A component thats bloated with unneeded functionality and design features.,
57,Y,Operations,Technology,1-High,3-Low,1-Highest,1-Plan,inspectionfailure,Accept,AgileTeam,Technology components lack stability.  Components that crash.,"Quality Assurance Planning,  Rework architecture"
58,Y,Operations,Technology,2-Moderate,1-High,2-Moderate,5-Accept,spi,Avoid,AgileTeam,Technology components are not extensible. Components that are difficult to extend with new capabilities.,
59,Y,Operations,Technology,1-High,1-High,3-Lowest,5-Accept,inspectionfailure,Avoid,AgileTeam,Technology components are not reliable. Components that fail after a short time.,
60,Y,Project,Technology,1-High,1-High,3-Lowest,5-Accept,external,Accept,ProjectManager,Information security incidents. The risk of a a security incident during the project (e.g. information is leaked).,
61,Y,Operations,Technology,1-High,1-High,3-Lowest,1-Plan,spi,Accept,ProjectManager,System outages. Critical systems such as your test environments go down.,
62,Y,Project,Technology,2-Moderate,1-High,2-Moderate,5-Accept,spi,Accept,AgileTeam,Legacy components lack documentation. Integration with undocumented legacy components is a high risk activity.,Requirements Planning. Refactor and document legacy code and integrations 
63,Y,Operations,Technology,2-Moderate,1-High,2-Moderate,1-Plan,cpi,Accept,ProductOwner,Legacy components are out of support.  Integration with legacy components that are no longer in support.,
64,Y,Operations,Technology,1-High,3-Low,1-Highest,3-Build,roi,Accept,Operations,"Components or products are not maintainable.  Technology components, tools or platforms that are difficult to maintain (e.g. lacking documentation, rare skills, complex or experimental).",
65,Y,Operations,Technology,1-High,3-Low,1-Highest,3-Build,roi,Avoid,Operations,Components or products cannot be operationalized.  Technology operations may have criteria for operationalization of new systems that need to be met.,
66,Y,Project,Technology,1-High,1-High,3-Lowest,5-Accept,spi,Avoid,ProjectManager,Project management tool problems & issues.  Technical problems with the project management tools themselves.,
67,Y,Operations,Technology,1-High,1-High,3-Lowest,5-Accept,latestart,Accept,Operations,Delays to required infrastructure.  Delays to infrastructure such as hardware or software.,
68,Y,Operations,Technology,1-High,3-Low,1-Highest,1-Plan,external,Avoid,ProductOwner,Failure to integrate with business processes. The risk that your product will fail to fit into the existing business.,
69,Y,Operations,Technology,1-High,3-Low,1-Highest,5-Accept,external,Avoid,AgileTeam,Failure to integrate with systems. The risk that your product will fail to integrate with existing systems.,
70,Y,Operations,Technology,1-High,1-High,3-Lowest,5-Accept,latestart,Avoid,Operations,Integration testing environments are not available. The risk that environments wont be available to test integration.,
71,Y,Project,Technology,1-High,1-High,3-Lowest,3-Build,external,Avoid,ProductOwner,"Failure to integration with the organization. The risk that your project fails to integrate with the organization. This happens when the project is focused on delivering something specific and fails to look at the organization as a whole. For example, you deliver a sales system but your organization does not have a sales team.",
72,Y,Project,Technology,1-High,3-Low,1-Highest,5-Accept,spi,Avoid,ProjectManager,Failure to integrate components. The risk that product components will fail to integrate with each other. This can represent a significant risk when youve outsourced work to a large number of vendors.,
73,Y,Operations,Technology,1-High,1-High,3-Lowest,3-Build,roi,Avoid,ProjectManager,Project disrupts operations. The last thing you want is for your project to disrupt business operations and damage the firms financial results. Think about risks beyond project failure.,
74,Y,Operations,Technology,1-High,1-High,3-Lowest,3-Build,roi,Avoid,ProjectManager,Project disrupts sales. The risk that the project disrupts sales effectiveness.,
75,Y,Operations,Technology,1-High,3-Low,1-Highest,3-Build,external,Avoid,ProjectManager,Project disrupts compliance. The risk that the project disrupts compliance processes such as audits and reporting.,
76,Y,Project,Requirements,2-Moderate,1-High,2-Moderate,1-Plan,external,Avoid,ProductOwner,"Requirements fail to align with strategy. Your requirements conflict with the firms strategy. If you sense that this is the case, list it as a risk.",
77,Y,Project,Requirements,2-Moderate,1-High,2-Moderate,1-Plan,roi,Avoid,ProductOwner,Requirements fail to align with business processes. The requirements make no sense in the context of the business.,
78,Y,Project,Requirements,2-Moderate,3-Low,2-Moderate,1-Plan,roi,Avoid,ProductOwner,Requirements fail to align with systems. The requirements fail to align with other systems (e.g. they duplicate functionality).,
79,Y,Project,Requirements,2-Moderate,1-High,2-Moderate,1-Plan,external,Avoid,ProductOwner,Requirements have compliance issues. If you have any doubt that requirements comply with the law list it as a risk.,
80,Y,Project,Requirements,2-Moderate,2-Moderate,2-Moderate,5-Accept,spi,Avoid,ProductOwner,Requirements are ambiguous. Requirements are unclear and open to interpretation.,
81,Y,Project,Requirements,2-Moderate,2-Moderate,2-Moderate,5-Accept,spi,Avoid,ProductOwner,Requirements are low quality. Requirements are not fit for purpose.,
82,Y,Project,Requirements,1-High,1-High,3-Lowest,1-Plan,latestart,Avoid,ProductOwner,Requirements are incomplete.  You can spot obvious holes in the requirements.,
83,Y,Decisions,Project,2-Moderate,1-High,2-Moderate,5-Accept,latestart,Avoid,Sponsor,Decision delays impact project.  Establish guidelines for decision turnaround time. Identify the risk that guidelines will be exceeded.,Communication planning improvement 
84,Y,Decisions,Project,2-Moderate,1-High,2-Moderate,5-Accept,sentiment,Avoid,Sponsor,Decisions are ambiguous.  Stakeholders may have a tendency to make decisions that are intentionally ambiguous (a responsibility avoidance technique). This can be identified as a risk and managed.,
85,Y,Project,Project,2-Moderate,1-High,2-Moderate,5-Accept,sentiment,Avoid,Sponsor,Decisions are low quality.  Decisions are not fit for purpose.,
86,Y,Project,Project,1-High,2-Moderate,2-Moderate,5-Accept,latestart,Avoid,Sponsor,Decisions are incomplete. Issue resolutions that do not address the issue or create more issues.,
87,Y,Project,Procurement,2-Moderate,1-High,2-Moderate,1-Plan,latestart,Avoid,Sponsor,No response to RFP. The risk that there is limited response to an RFP. This occurs when the RFP terms are unacceptable to vendors or if your firm has a bad reputation amongst vendors.,
88,Y,Project,Procurement,2-Moderate,1-High,2-Moderate,1-Plan,spi,Avoid,Sponsor,Low quality responses to RFP. Half hearted responses to your RFP that are unusable.,
89,Y,Project,Procurement,2-Moderate,1-High,2-Moderate,1-Plan,latestart,Avoid,Sponsor,Failure to negotiation a reasonable price for contracts.  Inability to negotiate a reasonable price for contracts. This occurs when the requirements or contract terms make vendors nervous.,
90,Y,Project,Procurement,2-Moderate,1-High,2-Moderate,1-Plan,roi,Avoid,Sponsor,Unacceptable contract terms. Inability to negotiate acceptable contract terms.,
91,Y,Project,Procurement,2-Moderate,3-Low,2-Moderate,5-Accept,spi,Avoid,ProjectManager,Conflict with vendor leads to project issues. The relationship with vendor turns to conflict and project issues mount.,
92,Y,Project,Procurement,2-Moderate,1-High,2-Moderate,5-Accept,spi,Avoid,ProjectManager,Conflict between vendors leads to project issues.  Your vendors develop conflict with each other and cooperation breaks down.,
93,Y,Project,Procurement,2-Moderate,1-High,2-Moderate,1-Plan,latestart,Avoid,ProjectManager,Vendors start late. The risk of a late start.,
94,Y,Project,Procurement,2-Moderate,1-High,2-Moderate,5-Accept,inspectionfailure,Avoid,ProjectManager,Vendor components fail to meet requirements. A vendor misunderstands requirements or delivers components that are completely off the mark.,
95,Y,Project,Procurement,2-Moderate,1-High,2-Moderate,5-Accept,inspectionfailure,Avoid,ProjectManager,Vendor components are low quality.  Vendor components are not fit for purpose.,
96,Y,Operations,Technology,2-Moderate,1-High,2-Moderate,5-Accept,roi,Avoid,Operations,Technology too expensive or complicated,
97,Y,Operations,Procurement,2-Moderate,1-High,2-Moderate,5-Accept,spi,Avoid,Sponsor,Service quality is low.  Services you procure such as consulting are not fit for purpose.,
98,Y,Operations,Procurement,2-Moderate,1-High,2-Moderate,5-Accept,external,Avoid,Sponsor,Vendor components introduce third party liability.  Vendor components introduce liability (e.g. they violate patents).,
99,Y,Operations,Requirements,1-High,3-Low,1-Highest,5-Accept,external,Avoid,Sponsor,Loss of intellectual property.  Vendors spy on you.,
100,Y,Project,Team,2-Moderate,1-High,2-Moderate,1-Plan,latestart,Avoid,ProjectManager,Project team lack authority to complete work. If you lack specific authorities required to deliver the project list this as a risk.,"Project Planning.  Clarify roles, responsibilities using RACI chart"
101,Y,Project,Team,1-High,3-Low,1-Highest,5-Accept,spi,Avoid,ProjectManager,Authority is unclear. It is unclear who has the authority to accomplish a project objective.,"Project Planning.  Clarify roles, responsibilities using RACI chart"
102,Y,Project,Stakeholders,2-Moderate,1-High,2-Moderate,5-Accept,latestart,Avoid,Sponsor,Delays to stakeholder approvals impact the project. The risk that approval deadlines will be exceeded.,Review Communication Plan and Stakeholder management plan. 
103,Y,Project,Stakeholders,2-Moderate,2-Moderate,2-Moderate,5-Accept,latestart,Avoid,Sponsor,Delays to financial approvals impact the project.  The risk of delays to financial approvals and processes to release funds.,Review Communication Plan and Stakeholder management plan. 
104,Y,Project,Stakeholders,2-Moderate,1-High,2-Moderate,1-Plan,latestart,Avoid,ProjectManager,Delays to procurement processes impact the project.  Many organizations have specific procurement processes that must be followed. These processes can be time consuming and highly variable. Document the risk that procurement process will exceed deadlines.,"Project Planning and Communication, plan for sponsor procurement process"
