riskid,riskselect,risktype,riskclassification,riskprobability,riskimpact,riskscore,risktimeline,risktrigger,riskresponse,riskowner,riskdescription,riskcontingency
105,Y,Project,Team,2-Moderate,1-High,2-Moderate,1-Plan,latestart,Avoid,ProjectManager,"Delays to recruiting processes impact the project.  If your project involves recruiting resources, this will typically take many months and is highly variable.",Resource Planning
106,Y,Project,Team,2-Moderate,1-High,2-Moderate,1-Plan,latestart,Avoid,ProjectManager,Delays to training impact the project.  If your training budget requires separate approvals (e.g. from functional managers or HR) document the risk that this will be slow.,Resource planning. 
107,Y,Project,Stakeholders,2-Moderate,1-High,2-Moderate,3-Build,sentiment,Avoid,ProductOwner,The project fails to match the organizations culture.  A culture fit issue between your product and the organization. If the organizations culture calls for employees to bring their own mobile devices to work (BYOD) and you build a user interface that only works on a specific device.,Stakeholder Management Plan
108,Y,Project,Team,2-Moderate,1-High,2-Moderate,5-Accept,engagement,Avoid,ProjectManager,An organizational restructuring throws the project into chaos.  If your project has a large footprint it may be extremely sensitive to organizational changes.,Resource Planning 
109,Y,Project,Team,2-Moderate,1-High,2-Moderate,5-Accept,external,Transfer,Sponsor,A merger or acquisition disrupts the project. Mergers & acquisitions may represent significant organizational changes.,"Resource Planning, Communication Plans"
110,Y,Project,Requirements,2-Moderate,1-High,2-Moderate,5-Accept,external,Accept,Sponsor,Legal & regulatory change impacts project.  If your project spans areas that are compliance-sensitive you may want to list regulatory change as a risk.,
111,Y,Project,Project,1-High,3-Low,1-Highest,5-Accept,external,Accept,Sponsor,Force Majeure (e.g. act of nature) impacts project.  Major disruptions such as acts of nature.,
112,Y,Project,Project,2-Moderate,1-High,2-Moderate,5-Accept,external,Avoid,ProductOwner,Market forces impact project.  Market changes impact project (e.g. a market crash).,
113,Y,Project,Technology,2-Moderate,1-High,2-Moderate,5-Accept,external,Avoid,AgileTeam,Technical change impacts project. A technology innovation changes your industry and impacts the project.,
114,Y,Project,Requirements,2-Moderate,1-High,2-Moderate,5-Accept,external,Accept,ProductOwner,Business change impacts project. A business innovation changes your industry and impacts the project.,
115,Y,Process,Project,2-Moderate,1-High,2-Moderate,5-Accept,spi,Avoid,AgileTeam,"Failure to follow methodology. If your organization asks you to streamline your project management methodology, that can be documented as a risk.",
116,Y,Process,Project,2-Moderate,2-Moderate,2-Moderate,5-Accept,spi,Avoid,ProjectManager,"Lack of management or control.  A lack of project management should be documented as a risk. For example, if resource constraints cause the project to skip certain project management best practices.",
117,Y,Process,Project,2-Moderate,2-Moderate,2-Moderate,5-Accept,spi,Avoid,ProjectManager,Errors in key project management processes Errors in project management such as schedule errors.,
118,Y,Process,Project,2-Moderate,1-High,2-Moderate,1-Plan,external,Accept,Sponsor,Counterparty risk. The risk you get back when you transfer a risk.,
119,Y,Project,Requirements,2-Moderate,3-Low,2-Moderate,5-Accept,inspectionfailure,Avoid,AgileTeam,Users reject the prototype.  One of the key methods of improving user acceptance is to get regular prototypes in front of users. There is always a risk that these prototypes will be rejected (require significant rework).,Decrease sprint cadence.  Get prototypes in front of users sooner to avoid doing work that is not what they want.
120,Y,Project,Requirements,1-High,2-Moderate,2-Moderate,5-Accept,inspectionfailure,Avoid,AgileTeam,User interface does not allow users to complete tasks The risk that the user interface does not allow users to complete end-to-end tasks.,
121,Y,Project,Technology,2-Moderate,3-Low,2-Moderate,5-Accept,inspectionfailure,Avoid,AgileTeam,"User interface is low quality. The user interface is buggy, slow or difficult to use.",
122,Y,Project,Technology,2-Moderate,1-High,2-Moderate,1-Plan,inspectionfailure,Avoid,AgileTeam,"User interface is not accessible.  In many jurisdictions, user interfaces must be accessible (e.g. employment or consumer law). Many organizational cultures require accessible user interfaces.",Review Quality Assurance Plan
123,Y,Project,Technology,2-Moderate,1-High,2-Moderate,5-Accept,roi,Avoid,ProductOwner,Project reduces business productivity.  Users identify your product(s) as reducing their productivity.,
124,Y,Project,Technology,2-Moderate,1-High,2-Moderate,5-Accept,roi,Avoid,AgileTeam,Project reduces innovation.  Users identify your product(s) as a roadblock to innovation.,
125,Y,Operations,Requirements,2-Moderate,1-High,2-Moderate,1-Plan,roi,Avoid,ProductOwner,"Product disrupts business metrics (measurements of objectives). Your product launch causes business KPIs to worsen. For example, if you launch a new ERP and Supply Chain Cycle Times jump.",
126,Y,Product,Requirements,2-Moderate,1-High,2-Moderate,5-Accept,inspectionfailure,Avoid,ProductOwner,Users reject the product. The general risk that users will reject your product.,
127,Y,Operations,Requirements,2-Moderate,1-High,2-Moderate,3-Build,roi,Avoid,ProductOwner,Product does not sell. Demand risk for the new product.,
128,Y,Project,Requirements,2-Moderate,1-High,2-Moderate,5-Accept,external,Avoid,AgileTeam,Product incurs legal liability. The product has quality issues that harm your customers.,
129,Y,Product,Requirements,2-Moderate,1-High,2-Moderate,3-Build,external,Avoid,ProductOwner,Product negatively affects brand. The product has quality issues that damage your brand.,
130,Y,Product,Requirements,2-Moderate,1-High,2-Moderate,3-Build,external,Avoid,ProductOwner,Product negatively affects reputation. The product generates negative publicity and/or damages customer relationships.,
